{
  "session": "h11-test",
  "pane": "w1:p1",
  "available": true,
  "reason": null,
  "agent": "codex",
  "text": "Done. The tests pass now:\n\n| suite | result |\n|---|---|\n| unit | 12 passed |\n\n中文也一样：全部通过。",
  "at": "2026-10-07T10:00:04.000Z",
  "complete": true,
  "phase": "final_answer",
  "truncated": false,
  "contract_revision": "omodachi.v1"
}
